{
  "schemaVersion": "glyph-coarse-base-library/v1",
  "id": "glyphcss/coarse-base-library-b57-v1",
  "description": "A deliberately small first-pass library of existing, admitted glyphcss asset renders. These are retrieval bases, not native-reference outputs.",
  "disposition": "coarse-vertical-slice-only",
  "contentSha256": "e7aaec095b7fba6967b4abd8f2cbbe8d300ca0c84c21e37dda2de766465f5e2b",
  "selection": {
    "minimumConfidence": 0.72,
    "cameraNeighborhood": {
      "maxRotXDelta": 18,
      "maxRotYDelta": 24,
      "maxZoomRelativeDelta": 0.25
    }
  },
  "controlContract": {
    "id": "glyph-control-tensor-contract/mvp-v2",
    "contentSha256": "a1e8600ad64f63b119e2113711b235a3007b28416ae03c38c2440eb6ed1c7a3f",
    "grid": { "cols": 42, "rows": 24 },
    "channels": 17
  },
  "source": {
    "kind": "existing-project-render",
    "assetRegistry": {
      "path": "reports/asset-registry.json",
      "contentSha256": "a9504ce13ae11b7b55508db476ffd90b8719310925d2ebc357eeabdb9a9def21"
    },
    "assetCorpus": {
      "path": "reports/asset-corpus.json",
      "configSha256": "bdd94345eff0690ff02501c1ff18bf9626486cb3c952587afc94effc669e0670"
    },
    "renderRecipe": "asset-corpus-b44-easy-preview",
    "generatorCalls": 0,
    "paidCalls": 0
  },
  "bases": [
    {
      "id": "base/cube-blue-box-v1",
      "label": "Blue industrial box",
      "image": {
        "path": "review/asset-corpus-b44-easy-preview/Box--c15ee1ca.png",
        "mimeType": "image/png",
        "width": 400,
        "height": 480,
        "sha256": "256efe31a6bb557bcf9657184fa265f2ce8112576cd191514a9ef494cafe2fb7"
      },
      "prompt": {
        "text": "weathered blue industrial box in a quiet studio",
        "tags": ["box", "cube", "blue", "industrial", "weathered", "quiet", "studio", "metal"]
      },
      "styleIds": ["base", "style A"],
      "camera": { "projection": "orthographic", "rotX": 63, "rotY": 38, "zoom": 55 },
      "controls": { "geometry": "cube", "sceneId": "generative/cube-v1" },
      "provenance": {
        "kind": "registry-admitted-exact-rgb-render",
        "assetId": "asset/c15ee1ca253975a5fc0a106f118200c967937457c1c0d1cca874b017bbf26b19",
        "licenseAuthority": "reports/asset-registry.json"
      }
    },
    {
      "id": "base/cube-wood-crate-v1",
      "label": "Warm wood crate",
      "image": {
        "path": "review/asset-corpus-b44-easy-preview/woodcrate--0fe28103.png",
        "mimeType": "image/png",
        "width": 400,
        "height": 480,
        "sha256": "a7d6e972a35d25d6092aa843a7dbdf19916722d949ef398499f471e429d78049"
      },
      "prompt": {
        "text": "warm wooden crate with rustic worn boards",
        "tags": ["box", "cube", "wood", "wooden", "crate", "warm", "rustic", "worn"]
      },
      "styleIds": ["base", "style B"],
      "camera": { "projection": "orthographic", "rotX": 63, "rotY": 38, "zoom": 55 },
      "controls": { "geometry": "cube", "sceneId": "generative/cube-v1" },
      "provenance": {
        "kind": "registry-admitted-exact-rgb-render",
        "assetId": "asset/0fe2810311ab143d2b6080a769230c1ddb0bf5a17f2ad1c0b4a92735c6ef002e",
        "licenseAuthority": "reports/asset-registry.json"
      }
    },
    {
      "id": "base/sphere-avocado-v1",
      "label": "Green avocado",
      "image": {
        "path": "review/asset-corpus-b44-easy-preview/avocado--ccc9c3ce.png",
        "mimeType": "image/png",
        "width": 400,
        "height": 480,
        "sha256": "4c52923853e1368dd1acd1e8df1955b788f44b9cb3343519cf896d087c64d031"
      },
      "prompt": {
        "text": "green organic avocado fruit with a warm stone",
        "tags": ["sphere", "round", "green", "organic", "avocado", "fruit", "food", "warm"]
      },
      "styleIds": ["base", "style A"],
      "camera": { "projection": "orthographic", "rotX": 63, "rotY": 38, "zoom": 55 },
      "controls": { "geometry": "sphere", "sceneId": "generative/sphere-v1" },
      "provenance": {
        "kind": "registry-admitted-exact-rgb-render",
        "assetId": "asset/ccc9c3ce56423720b09399c2351537207cd5a65f859f9e6e2f30922762f3abd4",
        "licenseAuthority": "reports/asset-registry.json"
      }
    },
    {
      "id": "base/sphere-weathered-rock-v1",
      "label": "Weathered grey rock",
      "image": {
        "path": "review/asset-corpus-b44-easy-preview/rock-medium--99881282.png",
        "mimeType": "image/png",
        "width": 400,
        "height": 480,
        "sha256": "d4d185e203ea77504a98deb74e048d6813d129baf41db377c6659e7f074d6e50"
      },
      "prompt": {
        "text": "weathered grey round rock on dark ground",
        "tags": ["sphere", "round", "rock", "stone", "grey", "weathered", "dark", "ground"]
      },
      "styleIds": ["base", "style B"],
      "camera": { "projection": "orthographic", "rotX": 63, "rotY": 38, "zoom": 55 },
      "controls": { "geometry": "sphere", "sceneId": "generative/sphere-v1" },
      "provenance": {
        "kind": "registry-admitted-exact-rgb-render",
        "assetId": "asset/99881282aa8ee2bc89ac782911b90909c84e33d693c3a9c2ef5085f1d8214ffe",
        "licenseAuthority": "reports/asset-registry.json"
      }
    },
    {
      "id": "base/prism-cottage-v1",
      "label": "Rustic cottage",
      "image": {
        "path": "review/asset-corpus-b44-easy-preview/cottage--a0a3b6ef.png",
        "mimeType": "image/png",
        "width": 400,
        "height": 480,
        "sha256": "a702795901745358c1fd5f29ef9f0924dbb2dac558552ddb05d857035c83a90b"
      },
      "prompt": {
        "text": "quiet rustic cottage with a steep roof",
        "tags": ["prism", "cottage", "house", "roof", "rustic", "quiet", "architecture", "building"]
      },
      "styleIds": ["base", "style A"],
      "camera": { "projection": "orthographic", "rotX": 63, "rotY": 38, "zoom": 55 },
      "controls": { "geometry": "prism", "sceneId": "generative/prism-v1" },
      "provenance": {
        "kind": "registry-admitted-exact-rgb-render",
        "assetId": "asset/a0a3b6ef57a641663445d4481ad359e479d69ccfa5ebab6bec58f7bfd171339e",
        "licenseAuthority": "reports/asset-registry.json"
      }
    },
    {
      "id": "base/prism-red-pickup-v1",
      "label": "Red pickup truck",
      "image": {
        "path": "review/asset-corpus-b44-easy-preview/Pickup-Truck--9d6b2e33.png",
        "mimeType": "image/png",
        "width": 400,
        "height": 480,
        "sha256": "0f4eb135a1045c9fc8a51da6e1919ea10c662be150dc4e7b9a3cff745b9a029a"
      },
      "prompt": {
        "text": "red pickup truck with a long angular body",
        "tags": ["prism", "red", "pickup", "truck", "vehicle", "angular", "long", "industrial"]
      },
      "styleIds": ["base", "style B"],
      "camera": { "projection": "orthographic", "rotX": 63, "rotY": 38, "zoom": 55 },
      "controls": { "geometry": "prism", "sceneId": "generative/prism-v1" },
      "provenance": {
        "kind": "registry-admitted-exact-rgb-render",
        "assetId": "asset/9d6b2e33af0d37bf42b2e7af850949f4efd0ddbb9a88077812d152d8b4c1c3eb",
        "licenseAuthority": "reports/asset-registry.json"
      }
    }
  ]
}
